"Time","Type","Date","Owner.operator","Registration","MSN","Year.of.manufacture","Engine.model","Fatalities","Other.fatalities","Aircraft.damage","Category","Location","Phase","Nature","Departure.airport","Destination.airport","Investigating.agency","Confidence.Rating","Narrative","detail_link"
"11:15","    de Havilland Canada DHC-6 Vista Liner 300","Friday 6 March 2020","Grand Canyon Airlines","N72GC","264","1969Total airframe hrs:50964 hours",NA,"0 / Occupants: 2","0","Substantial","Accident","Boulder City Municipal Airport, NV (BLD) -   United States of America","Landing","Training","Boulder City Municipal Airport, NV (BLD/KBVU)","Boulder City Municipal Airport, NV (BLD/KBVU)"," NTSB","Accident investigation report completed and information captured","An operator's pilot was conducting training for a newly hired pilot for a first officer position in the twin-engine airplane. After accomplishing air work, the pilots returned to the airport to practice landings and takeoffs. According to both pilots, the first approach was normal, and the airplane touched down slightly right of the runway centerline. The trainee pilot stated that, after touchdown, the airplane began drifting further right and that he was unable to correct the deviation. The trainer pilot reported that, when directional control became unstable, he told the trainee, ""I have the controls."" The trainer pilot saw that the trainee pilot released his hands from the engine power levers and the yoke, but the airplane continued to deviate to the right, contrary to his control inputs and his addition of asymmetric power to the engines. The trainer pilot realized that, based on his inputs, the airplane should have returned to the centerline but that it did not and that it was behaving as if the trainee pilot was applying some braking. At that point, the trainer pilot again told the trainee pilot to release the controls, and he used the brakes, which he reported applied and released normally. Subsequently, the airplane exited the right side of the runway and impacted a ditch. The airplane sustained substantial damage to the right wing. The trainer pilot and the operator reported that there were no mechanical failures or malfunctions with the airplane that would have precluded normal operation. The trainer pilot reported that he believed the trainee pilot's feet were either on the brakes or interfered with his brake and/or rudder application attempts. The trainee pilot reported that he could not recall the position of his feet after he relinquished airplane control to the trainer pilot. Probable Cause: The trainee pilot's loss of directional control during landing and his subsequent unintentional control interference with the brakes and/or rudder during the trainer pilot's attempted remedial action, which resulted in a runway excursion and collision with a ditch.Accident investigation:   Investigating agency: NTSB Report number: WPR20CA112 Status: Investigation completedDuration: 5 monthsDownload report:  Final report Sources: History of this aircraft Other occurrences involving this aircraft ï»¿  25 May 1999 N72GC Era Aviation 0 Anchorage, AK sub Bird strike Location  Revision history:Date/timeContributorUpdates The Aviation Safety Network is an exclusive service provided by: Quick Links: ASN Home Send Correction / FeedbackFSF Home DisclaimerCopyright Contact Us Privacy PolicyPress / Media CONNECT WITH US: ©2025 Flight Safety Foundation 1920 Ballenger Av, 4th Fl. Alexandria, Virginia 22314www.FlightSafety.org window.NREUM||(NREUM={});NREUM.info={""beacon"":""bam.nr-data.net"",""licenseKey"":""NRJS-b28a197507ed0552825"",""applicationID"":""582319234"",""transactionName"":""YwdaMkUCWRZSBhJfXVpNbRReTEAMWAwEV0FRTU8PXAoZFVsV"",""queueTime"":0,""applicationTime"":3,""atts"":""T0BZRA0YShg="",""errorBeacon"":""bam.nr-data.net"",""agent"":""""}ï»¿","https://aviation-safety.net/database/record.php?id=20200306-0"
"19:55","    Boeing 767-3Q8ER","Sunday 8 March 2020","Omni Air International","N477AX","29390/870","2002","General Electric CF6-80C2B6F","0 / Occupants: 181","0","Substantial, repaired","Accident","Shannon Airport (SNN) -   Ireland","Landing","Passenger - Non-Scheduled/charter/Air Taxi","Bangor International Airport, ME (BGR/KBGR)","Shannon Airport (SNN/EINN)"," AAIU","Information is only available from news, social media or unofficial sources","Omni Air flight 346, a Boeing 767-300ER, bounced and touched down hard on runway 24 at Shannon Airport, Ireland. There were no injuries and airplane suffered creases all around the forward fuselage.METAR: 19:00 UTC / 19:00 local time: EINN 081900Z 27018G32KT 9999 FEW009 FEW020CB 07/03 Q1004 TEMPO 4000 SHRA21:00 UTC / 21:00 local time: EINN 082100Z 27022KT 9999 FEW009 BKN018CB 06/04 Q1006 TEMPO 4000 SHRA Sources: thejournal.ie History of this aircraft Other occurrences involving this aircraft ï»¿  29 July 2011 EI-DZH Rossiya 0 About 150nm south of Minsk at FL360 min Engine failure Location  Revision history:Date/timeContributorUpdates The Aviation Safety Network is an exclusive service provided by: Quick Links: ASN Home Send Correction / FeedbackFSF Home DisclaimerCopyright Contact Us Privacy PolicyPress / Media CONNECT WITH US: ©2025 Flight Safety Foundation 1920 Ballenger Av, 4th Fl. Alexandria, Virginia 22314www.FlightSafety.org window.NREUM||(NREUM={});NREUM.info={""beacon"":""bam.nr-data.net"",""licenseKey"":""NRJS-b28a197507ed0552825"",""applicationID"":""582319234"",""transactionName"":""YwdaMkUCWRZSBhJfXVpNbRReTEAMWAwEV0FRTU8PXAoZFVsV"",""queueTime"":0,""applicationTime"":8,""atts"":""T0BZRA0YShg="",""errorBeacon"":""bam.nr-data.net"",""agent"":""""}ï»¿","https://aviation-safety.net/database/record.php?id=20200308-0"
"06:25","    Airbus A330-343","Monday 9 March 2020","Thai Airways International","HS-TEU","1090","2010","Rolls-Royce Trent 772B-60","0 / Occupants: 92","0","Substantial, repaired","Accident","Vientiane-Wattay Airport (VTE) -   Laos","Taxi","Passenger - Scheduled","Vientiane-Wattay Airport (VTE/VLVT)","Bangkok-Suvarnabhumi International Airport (BKK/VTBS)",NA,NA,"A Thai Airways flight 575, an Airbus A330-343 (HS-TEU), struck a parked Gulfstream G-IVSP business jet (M-YWAY) at Vientiane-Wattay Airport in Laos.Sources: metro.co.uk   Location  Images: photo (c) Leslie Snelleman; Bangkok-Suvarnabhumi International Airport (BKK/VTBS); 19 May 2015 Revision history:Date/timeContributorUpdates The Aviation Safety Network is an exclusive service provided by: Quick Links: ASN Home Send Correction / FeedbackFSF Home DisclaimerCopyright Contact Us Privacy PolicyPress / Media CONNECT WITH US: ©2025 Flight Safety Foundation 1920 Ballenger Av, 4th Fl. Alexandria, Virginia 22314www.FlightSafety.org window.NREUM||(NREUM={});NREUM.info={""beacon"":""bam.nr-data.net"",""licenseKey"":""NRJS-b28a197507ed0552825"",""applicationID"":""582319234"",""transactionName"":""YwdaMkUCWRZSBhJfXVpNbRReTEAMWAwEV0FRTU8PXAoZFVsV"",""queueTime"":0,""applicationTime"":3,""atts"":""T0BZRA0YShg="",""errorBeacon"":""bam.nr-data.net"",""agent"":""""}ï»¿","https://aviation-safety.net/database/record.php?id=20200309-1"
"06:25","    Gulfstream G-IVSP","Monday 9 March 2020","Platinum Jet Co., Ltd.","M-YWAY","1486","2002",NA,"0 / Occupants: 0","0","Substantial, repaired","Accident","Vientiane-Wattay Airport (VTE) -   Laos","Standing","-","-","-",NA,NA,"A Thai Airways Airbus A330-343 (HS-TEU), performing flight TG575, struck a parked Gulfstream G-IVSP business jet (M-YWAY) at Vientiane-Wattay Airport in Laos.Sources: metro.co.uk   Location  Revision history:Date/timeContributorUpdates The Aviation Safety Network is an exclusive service provided by: Quick Links: ASN Home Send Correction / FeedbackFSF Home DisclaimerCopyright Contact Us Privacy PolicyPress / Media CONNECT WITH US: ©2025 Flight Safety Foundation 1920 Ballenger Av, 4th Fl. Alexandria, Virginia 22314www.FlightSafety.org window.NREUM||(NREUM={});NREUM.info={""beacon"":""bam.nr-data.net"",""licenseKey"":""NRJS-b28a197507ed0552825"",""applicationID"":""582319234"",""transactionName"":""YwdaMkUCWRZSBhJfXVpNbRReTEAMWAwEV0FRTU8PXAoZFVsV"",""queueTime"":0,""applicationTime"":4,""atts"":""T0BZRA0YShg="",""errorBeacon"":""bam.nr-data.net"",""agent"":""""}ï»¿","https://aviation-safety.net/database/record.php?id=20200309-0"
"15:40","    de Havilland Canada DHC-3T Vazar Turbine Otter","Thursday 12 March 2020","Martini Aviation Ltd.","C-GTMW","427","1962","Pratt & Whitney Canada PT6A-34A","0 / Occupants: 2","0","Substantial","Accident","Fort Langley Airport, BC -   Canada","Landing","Training","Fort Langley Airport, BC (CBQ2)","Fort Langley Airport, BC (CBQ2)",NA,"Information verified through data from accident investigation authorities","A DHC-3T Turbine Otter was conducting circuits at Fort Langley (CBQ2), BC. During the second landing on runway 26, the aircraft bounced and started an uncontrolled veer to the left. The aircraft departed the left side of the runway onto the adjacent ramp. The left wing tip contacted a parked trailer causing the aircraft to pivot left and impact a second trailer before coming to an abrupt stop. The aircraft sustained substantial damage. There were no injuries and no post impact fire. The ELT automatically activated and the signal was received.Sources: TSB A20P0036   Location  Revision history:Date/timeContributorUpdates The Aviation Safety Network is an exclusive service provided by: Quick Links: ASN Home Send Correction / FeedbackFSF Home DisclaimerCopyright Contact Us Privacy PolicyPress / Media CONNECT WITH US: ©2025 Flight Safety Foundation 1920 Ballenger Av, 4th Fl. Alexandria, Virginia 22314www.FlightSafety.org window.NREUM||(NREUM={});NREUM.info={""beacon"":""bam.nr-data.net"",""licenseKey"":""NRJS-b28a197507ed0552825"",""applicationID"":""582319234"",""transactionName"":""YwdaMkUCWRZSBhJfXVpNbRReTEAMWAwEV0FRTU8PXAoZFVsV"",""queueTime"":0,""applicationTime"":45,""atts"":""T0BZRA0YShg="",""errorBeacon"":""bam.nr-data.net"",""agent"":""""}ï»¿","https://aviation-safety.net/database/record.php?id=20200312-1"
"","    Beechcraft 200 Super King Air","Thursday 12 March 2020","private","HK-5075","BB-801","1981",NA,"2 / Occupants: 2","0","Destroyed, written off","Accident","Claura Arriba, Iriona, ColÃ³n -   Honduras","Unknown","Illegal Flight","","",NA,"Little or no information is available","A Beechcraft 200 Super King Air, registered HK-5075, crashed in a mountainous area near Iriona, ColÃ³n, Honduras. The aircraft was destroyed and two occupants had died. Soldiers at retrieved empty wrappers from the scene that were likely used to carry cocaine. It was suspected that residents of the area had taken the drugs.Sources: laprensa.hn   Location  Revision history:Date/timeContributorUpdates The Aviation Safety Network is an exclusive service provided by: Quick Links: ASN Home Send Correction / FeedbackFSF Home DisclaimerCopyright Contact Us Privacy PolicyPress / Media CONNECT WITH US: ©2025 Flight Safety Foundation 1920 Ballenger Av, 4th Fl. Alexandria, Virginia 22314www.FlightSafety.org window.NREUM||(NREUM={});NREUM.info={""beacon"":""bam.nr-data.net"",""licenseKey"":""NRJS-b28a197507ed0552825"",""applicationID"":""582319234"",""transactionName"":""YwdaMkUCWRZSBhJfXVpNbRReTEAMWAwEV0FRTU8PXAoZFVsV"",""queueTime"":0,""applicationTime"":3,""atts"":""T0BZRA0YShg="",""errorBeacon"":""bam.nr-data.net"",""agent"":""""}ï»¿","https://aviation-safety.net/database/record.php?id=20200312-0"
"18:10","    Cessna 525 CitationJet","Friday 13 March 2020","Servicios 5250084","YV3452","525-0084","1994","Williams International FJ44-1A","2 / Occupants: 2","0","Destroyed, written off","Accident","Porlamar-del Caribe Santiago MariÃ±o International Airport (PMV) -   Venezuela","Landing","Private","Porlamar-del Caribe Santiago MariÃ±o International Airport (PMV/SVMG)","Charallave-Ãscar Machado Zuloaga Airport (SVCS)"," JIAAC Venezuela","Information verified through data from accident investigation authorities","A Cessna 525 CitationJet suffered a runway excursion after returning to land at Porlamar-del Caribe Santiago MariÃ±o International Airport, Venezuela.  The aircraft took off from runway 09 at Porlamar Airport (PMV), bound for Charallave, when the right engine failed.  The flight crew radioed their intention to returned to land on runway 27 at Porlamar. After landing the aircraft suffered a runway excursion. The aircraft struck rocks and construction materials. A fire erupted, consuming the forward part of the aircraft. Both pilots died after the accident. The captain died on March 14th as a result of the burn injuries. The copilot died on March 30th, due to pneumonia caused by internal burns. Weather at the time of the accident included unlimited visibility and a 90 degree wind at 20-25 knots.Accident investigation:   Investigating agency: JIAAC Venezuela Report number: 012/2020 Status: Preliminary reportDuration: Download report:  Preliminary report Sources: elpitazo.net  2001.com.ve  reporteconfidencial.info History of this aircraft Other occurrences involving this aircraft ï»¿  16 February 2011 G-CITJ Centreline Air Charter 0 Bristol International Airport, Bristol non Location  Revision history:Date/timeContributorUpdates The Aviation Safety Network is an exclusive service provided by: Quick Links: ASN Home Send Correction / FeedbackFSF Home DisclaimerCopyright Contact Us Privacy PolicyPress / Media CONNECT WITH US: ©2025 Flight Safety Foundation 1920 Ballenger Av, 4th Fl. Alexandria, Virginia 22314www.FlightSafety.org window.NREUM||(NREUM={});NREUM.info={""beacon"":""bam.nr-data.net"",""licenseKey"":""NRJS-b28a197507ed0552825"",""applicationID"":""582319234"",""transactionName"":""YwdaMkUCWRZSBhJfXVpNbRReTEAMWAwEV0FRTU8PXAoZFVsV"",""queueTime"":0,""applicationTime"":1,""atts"":""T0BZRA0YShg="",""errorBeacon"":""bam.nr-data.net"",""agent"":""""}ï»¿","https://aviation-safety.net/database/record.php?id=20200313-0"
"15:58","    Raytheon Hawker 800XP","Saturday 14 March 2020","Gemini Air Group","N100AG","258747","2005Total airframe hrs:4823 hours","Garrett TFE731-5BR-1H","0 / Occupants: 2","0","Substantial, written off","Accident","Phoenix-Scottsdale Municipal Airport, AZ (SCF) -   United States of America","Landing","Private","Rogers Municipal Airport-Carter Field, AR (ROG/KROG)","Phoenix-Scottsdale Municipal Airport, AZ (SCF/KSDL)"," NTSB","Accident investigation report completed and information captured","The Hawker 800XP, N100AG, was substantially damaged after veering off the runway and impacting a sign at the Scottsdale Airport, Arizona.  The pilot stated that the flight departed from Roger, Arkansas about 13:15 with the planned destination of Scottsdale. After an uneventful flight, the pilot made a stabilized approach to runway 21. Upon landing, the airplane touched down on the runway centerline in light and variable winds. The pilot recalled that the touchdown felt normal. During the landing roll, the airplane began to veer to the right and the pilot added left rudder in an effort to correct. Despite his attempts of full left rudder deflection, the airplane continued to veer off the runway. The airplane continued off the runway surface and encountered large rocks located between the runway and taxiway. The airplane collided with runway lights and a sign puncturing the left wing and resulted in substantial damage; the engines both sustained foreign object damage from the rocks. The pilot opined that the loss of control was a result of the nosewheel steering wheel not being aligned correctly. Probable Cause: The pilotÂs inability to maintain directional control during landing for undetermined reasons, which resulted in a runway excursion.METAR: 22:53 UTC / 15:53 local time: KSDL 142253Z 00000KT 10SM SCT060 21/06 A3006 RMK AO2 SLP165 T02110056Accident investigation:   Investigating agency: NTSB Report number: WPR20LA109 Status: Investigation completedDuration: 2 years and 3 monthsDownload report:  Final report Sources:  Location  Revision history:Date/timeContributorUpdates The Aviation Safety Network is an exclusive service provided by: Quick Links: ASN Home Send Correction / FeedbackFSF Home DisclaimerCopyright Contact Us Privacy PolicyPress / Media CONNECT WITH US: ©2025 Flight Safety Foundation 1920 Ballenger Av, 4th Fl. Alexandria, Virginia 22314www.FlightSafety.org window.NREUM||(NREUM={});NREUM.info={""beacon"":""bam.nr-data.net"",""licenseKey"":""NRJS-b28a197507ed0552825"",""applicationID"":""582319234"",""transactionName"":""YwdaMkUCWRZSBhJfXVpNbRReTEAMWAwEV0FRTU8PXAoZFVsV"",""queueTime"":0,""applicationTime"":8,""atts"":""T0BZRA0YShg="",""errorBeacon"":""bam.nr-data.net"",""agent"":""""}ï»¿","https://aviation-safety.net/database/record.php?id=20200314-0"
"09:20","    Cessna 208B Super Cargomaster","Tuesday 17 March 2020","Planemasters","N274PM","208B0705","1998","Pratt & Whitney Canada PT6A-114A","1 / Occupants: 1","0","Destroyed, written off","Accident","NW of La Crosse, Rush County, KS -   United States of America","En route","Cargo","Wichita Dwight D. Eisenhower National Airport, KS (ICT/KICT)","Hays Municipal Airport, KS (HYS/KHYS)"," NTSB","Accident investigation report completed and information captured","A Planemaster Ltd Cessna 208B Super Cargomaster, performing cargo flight PMS1670, from Wichita Dwight D. Eisenhower National Airport (ICT/KICT) to Hays Municipal Airport (HYS/KHYS) crashed in wheat field terrain northwest of La Crosse, Rush County, Kansas. The aircraft took off from ICT at 07:52 local time (12:52 UTC). At 08:25, the HYS automated weather observation service was reporting, in part, winds from 080Â° at 11 knots, visibility 1 statute mile, and overcast clouds at 200 ft above ground level.  The pilot made an ILS approach to runway 34 but was forced to execute a missed approach. The pilot stated to ATC his intention to attempt the ILS approach to runway 34 a second time. At 08:41, the HYS weather indicated that visibility had dropped to 0,25 statute mile in fog. Again, the pilot performed a missed approach. About 08:59 the pilot stated his intention to divert to Great Bend Airport (GBD), Kansas. The airplane began a turn to the south toward GBD while climbing to about 7,000 ft.  Around 09:06, the pilot began making unintelligible radio communications that air traffic controllers stated were unreadable. About 09:15, the controller asked the accident pilot if he was turning directly to GBD. After an unintelligible response from the pilot, the controller stated Âalright plane master sixteen seventy it's very difficult to understand there might be something wrong with uh your cockpit or your pressurization plane master sixteen seventy oxygen oxygen.Â About a minute later, the pilot was more easily understood. However, about 09:18, ATC made a transmission with no response from the pilot. At the same time the airplane began a descent and left turn.  About 09:20, an unintelligible response was received from the accident airplane. ATC then made numerous transmissions to the accident pilot urging him to utilize oxygen and open a window. No further communications were received from the accident airplane. The aircraft was found to have crashed in a field. The airplane's tail and wings were visible above ground, with the forward fuselage and engine section buried several feet under the terrain, consistent with a near-vertical, high-speed impact. The main landing gear was bent aft towards the tail with the left and right main wheel protruding from the ground. Probable Cause: ""An infight loss of control as a result of pilot impairment, the cause of which could not be determined.""METAR: 12:56 UTC / 07:56 local time: KHYS 171256Z AUTO 08010KT 3SM BR OVC002 03/03 A3027 RMK AO2 SLP261 T0028002813:09 UTC / 08:09 local time: KHYS 171309Z AUTO 07010KT 1 1/2SM BR OVC002 03/03 A3027 RMK AO213:12 UTC / 08:12 local time: KHYS 171312Z AUTO 07010KT 3/4SM BR OVC002 03/03 A3027 RMK AO213:20 UTC / 08:20 local time: KHYS 171320Z AUTO 09010KT 1/2SM FG OVC002 03/03 A3026 RMK AO213:25 UTC / 08:25 local time: KHYS 171325Z AUTO 08011KT 1SM BR OVC002 03/03 A3026 RMK AO213:32 UTC / 08:32 local time: KHYS 171332Z AUTO 08012KT 1 1/2SM BR OVC002 03/03 A3026 RMK AO213:38 UTC / 08:38 local time: KHYS 171338Z AUTO 07011KT 3/4SM BR OVC002 03/03 A3027 RMK AO213:41 UTC / 08:41 local time: KHYS 171341Z AUTO 07010KT 1/4SM FG OVC002 03/03 A3027 RMK AO213:56 UTC / 08:56 local time: KHYS 171356Z AUTO 07010KT 1/4SM FG OVC002 03/02 A3026 RMK AO2 SLP260 T0028002214:29 UTC / 09:29 local time: KHYS 171429Z AUTO 09009KT 3/4SM BR OVC002 03/03 A3026 RMK AO2 VIS 1/4V514:33 UTC / 09:32 local time: KHYS 171432Z AUTO 10010KT 1 1/4SM BR OVC002 03/03 A3026 RMK AO2 VIS 1/2V5Accident investigation:   Investigating agency: NTSB Report number: CEN20LA122 Status: Investigation completedDuration: 2 years 1 monthDownload report:  Final report Sources: ksn.com  kwch.com  flightaware.com   Location  Revision history:Date/timeContributorUpdates The Aviation Safety Network is an exclusive service provided by: Quick Links: ASN Home Send Correction / FeedbackFSF Home DisclaimerCopyright Contact Us Privacy PolicyPress / Media CONNECT WITH US: ©2025 Flight Safety Foundation 1920 Ballenger Av, 4th Fl. Alexandria, Virginia 22314www.FlightSafety.org window.NREUM||(NREUM={});NREUM.info={""beacon"":""bam.nr-data.net"",""licenseKey"":""NRJS-b28a197507ed0552825"",""applicationID"":""582319234"",""transactionName"":""YwdaMkUCWRZSBhJfXVpNbRReTEAMWAwEV0FRTU8PXAoZFVsV"",""queueTime"":0,""applicationTime"":57,""atts"":""T0BZRA0YShg="",""errorBeacon"":""bam.nr-data.net"",""agent"":""""}ï»¿","https://aviation-safety.net/database/record.php?id=20200317-0"
