"Time","Type","Date","Owner.operator","Registration","MSN","Year.of.manufacture","Engine.model","Fatalities","Other.fatalities","Aircraft.damage","Category","Location","Phase","Nature","Departure.airport","Destination.airport","Investigating.agency","Confidence.Rating","Narrative","detail_link"
"20:53","    Gulfstream G150","Friday 24 January 2020","Compass Aviation LLC","N373ML","204","2006Total airframe hrs:3519 hours","Honeywell TFE731-40AR-200G","0 / Occupants: 4","0","Substantial, repaired","Accident","San Juan-Fernando Luis Ribas Dominicci Airport (SIG) -   Puerto Rico","Landing","Private","Houston International Airport, TX (HOU/KHOU)","San Juan-Fernando Luis Ribas Dominicci Airport (SIG/TJIG)"," NTSB","Accident investigation report completed and information captured","A Gulfstream G150, N373ML, was substantially damaged when it was involved in an accident at the Fernando Luis Ribas Dominicci Airport (TJIG), San Juan, Puerto Rico. The two pilots and two passengers were not injured.  According to the pilot, the instrument approach to runway 09 was ""stabilized, on glide path, and on speed."" The landing reference speed (Vref) was 122 knots and touchdown occurred at the 1,000 ft markers. The thrust reversers were deployed until 70 knots. The pilot then noticed standing water on the runway, and as the airplane encountered the standing water, it yawed to the right and departed the runway. The airplane impacted a chain-link fence and sustained substantial damage to the right wing spar. The pilot further reported that there were no mechanical malfunctions or failures with the airplane that would have precluded normal operation. Weather observations at TJIG were reported only when the air traffic control tower was open (0700 to 1900), and there were no automated weather observation stations at the airport. The last available observation occurred at 1745, which indicated that rain showers were in the vicinity of the airport to the southwest and northwest. Automated weather observations reported at the San Juan Luis Marin International Airport (TJSJ), located about 5 miles to the east of TJIG, included rain showers at that airport or in the vicinity for the 4 hours preceding the accident. At 2056, the conditions reported at TJSJ included heavy rain showers and mist. Probable Cause: ""The pilotÂs loss of control during landing on a wet runway after encountering standing water.""Accident investigation:   Investigating agency: NTSB Report number: ERA20LA221 Status: Investigation completedDuration: 2 years and 2 monthsDownload report:  Final report Sources:  Location  Images: photo (c) tjig-flyer; San Juan-Fernando Luis Ribas Dominicci Airport (SIG); 24 January 2020 Revision history:Date/timeContributorUpdates The Aviation Safety Network is an exclusive service provided by: Quick Links: ASN Home Send Correction / FeedbackFSF Home DisclaimerCopyright Contact Us Privacy PolicyPress / Media CONNECT WITH US: ©2025 Flight Safety Foundation 1920 Ballenger Av, 4th Fl. Alexandria, Virginia 22314www.FlightSafety.org window.NREUM||(NREUM={});NREUM.info={""beacon"":""bam.nr-data.net"",""licenseKey"":""NRJS-b28a197507ed0552825"",""applicationID"":""582319234"",""transactionName"":""YwdaMkUCWRZSBhJfXVpNbRReTEAMWAwEV0FRTU8PXAoZFVsV"",""queueTime"":0,""applicationTime"":3,""atts"":""T0BZRA0YShg="",""errorBeacon"":""bam.nr-data.net"",""agent"":""""}ï»¿","https://aviation-safety.net/database/record.php?id=20200124-0"
"13:09","    Bombardier E-11A (Global Express)","Monday 27 January 2020","US Air Force (USAF)","11-9358","9358","2009",NA,"2 / Occupants: 2","0","Destroyed","Accident","39 km NNW of Sharana FOB -   Afghanistan","En route","Military","Kandahar Airport (KDH/OAKN)","Kandahar Airport (KDH/OAKN)"," USAF AIB","Accident investigation report completed and information captured","A Bombardier E-11A operated by the US Air Force crashed in the Deh Yak district in Afghanistan, killing both pilots. The aircraft, from 430th EECS, was outfitted with a Battlefield Airborne Communications Node (BACN) and operated as a communications-relay platform out of Kandahar Airport, Afghanistan. At the time of the accident the aircraft operated on a combat sortie as well as a Mission Qualification Training for the first officer. Takeoff occurred at 11:05 local time. The flight proceeded to the assigned orbit using standard departure/climb procedures. The crew assumed a circular orbit just west of Kabul at 42,000 feet altitude at about 11:36. At 12:50, the crew requested and was cleared by ATC to climb from 42,000 feet altitude to 43,000 feet altitude. The engine revolutions per minute (RPMs) advanced and the crew initiated the climb with the autopilot, gaining about 300 feet. At 12:50:52, a fan blade broke free and separated from the N1 first-stage turbofan of the left engine, causing major damage and resulting in the immediate shutdown of that engine by the Electronic Engine Controller (EEC), a subsystem of the Full Authority Digital Engine Controller (FADEC). This was accompanied by a bang. Simultaneous with the bang, the CVR recording stopped.  Within one to two seconds after the initial event, the autothrottles disengaged automatically. The autopilot was engaged and it remained engaged. Bank angles remained essentially constant, consistent with a circular orbit, and the aircraft descended from an altitude of 42,300 feet to 41,000 feet. Ten seconds after the catastrophic left engine failure, the crew retarded both throttles to just less than halfway (14 degrees; total throttle range is from 0 Â 40 degrees) for one second, then slightly advancing the left throttle separately (26 degrees) for one second, then retarding it to align with the right throttle (both at 16 degrees) for one second, and finally splitting the throttles to advance the left throttle (to 31 degrees) while retarding the right to idle (0 degrees). Nine seconds after moving the right throttle to idle, the crew placed the right engine run switch to off, shutting down the right engine. Finally, at 12:51:19, the left throttle was advanced to full power (40 degrees), briefly cycled then brought to idle. At 12:51:23, both throttles were advanced from idle to full power. It is likely the crewÂs first actions, including the shutdown, were hastened by a sense of urgency due to aircraft vibrations and other auditory/sensory cues, reinforced by the startle response. The crew announced to Kabul ATC that they had lost both engines and that they intended to proceed to Kandahar, which was well outside the E-11A glide capabilities. This intent suggests that the crew was confident of airstarting one or both engines. While the crew would have waited, in accordance with the checklist, to 30,000 feet to attempt an airstart, an airstart of the right engine should have been successful, whether accomplished with windmilling airspeed or with the assistance of the APU. However, airstarts of the left engine would have failed due to the original damage. There is no DFDR data to definitively confirm whether an engine airstart attempt was made. At 13:03:30, the crew announced to ATC that they were going to land at FOB Sharana. The aircraft continued to glide without engine power and was not able to reach Sharana. At approximately 13:09, the aircraft impacted the ground approximately 21 NM (39 km) short of Sharana, on a heading of roughly 140 degrees, consistent with a direct flight path towards Sharana. The terrain was unpopulated, largely flat, and covered in snow. The wings show the slats out and the flaps appear to be extended, suggesting that the aircraft had been configured for, and presumably slowed for, landing. It is likely that the crew attempted to make a forced landing. While the terrain was largely flat, the aircraft impacted berms and ditches, roughly estimated between 3-6 feet high. Weather at Sharana was reported to have 1000 foot ceilings, and pilot testimony confirms approximately 1000 foot ceilings in the vicinity of the accident site. Accordingly, the crew may have had less than a minute to maneuver after exiting the clouds and seeing the terrain. It appears that while the aircraft touched down, it impacted a smaller berm almost immediately, then more completely impacted the ground and skidded to a halt in approximately 340 meters. During this time the wings were ripped from the aircraft, and subsequently much of the cockpit and cabin were destroyed by fire. The Accident Investigation Board (AIB) President found by a preponderance of the evidence that the cause of the mishap was the MC's error in analyzing which engine had catastrophically failed (left engine). This error resulted in the MC's decision to shutdown the operable right engine creating a dual engine out emergency. The AIB President also found by a preponderance of the evidence that the MC's failure to airstart the right engine and their decision to recover the MA to KAF substantially contributed to the mishap.Accident investigation:   Investigating agency: USAF AIB Report number: final report Status: Investigation completedDuration: 9 monthsDownload report:  Final report Sources: https://www.wsj.com/articles/u-s-recovers-two-killed-in-air-force-crash-in-taliban-territory-11580232907  https://www.airforcetimes.com/news/your-air-force/2021/01/21/broken-fan-blade-shutdown-of-wrong-engine-led-to-fatal-e-11-crash-in-afghanistan-report-says/  https://www.militarytimes.com/news/your-military/2020/01/27/us-army-investigating-plane-crash-in-taliban-held-area/  https://aerossurance.com/air-accidents-incidents/usaf-e11a-global-express-psmicr/  https://www.acc.af.mil/News/Article-Display/Article/2478327/e-11a-accident-investigation-board-report-released/  https://www.afjag.af.mil/Portals/77/AIB-Reports/2020/27JAN20%20ACC%20Bagram%20Airfield%20E-11%20AIB%20Report.pdf  Location  Images: photo (c) Bart Hoekstra; Mildenhall RAF Station (MHZ/EGUN); 11 March 2019 Media: Startled Shutdown - Fatal USAF E-11A Global Express PSM+ICR Accident: The crew shut down the serviceable engine and try to reach an airfield 230 NM away rather than ones close by. aerossurance.com/air-accident... #military #accident #flightsafety #aviationsafety #humanfactors[image or embed]— Aerossurance (@aerossurance.bsky.social) January 3, 2025 at 11:46 AMStartled Shutdown - Fatal USAF E-11A Global Express PSM+ICR Accident: The aircraft force lands in Afghanistan and burns out.  aerossurance.com/air-accident... #military #accident #flightsafety #aviationsafety #humanfactors[image or embed]— Aerossurance (@aerossurance.bsky.social) January 3, 2025 at 11:48 AMRevision history:Date/timeContributorUpdates30-Dec-2024 13:07 Aerossurance Updated [Source, ]31-Dec-2024 15:34 Aerossurance Updated [Source, ]31-Dec-2024 17:21 Aerossurance Updated [Operator, Source, Embed code, Narrative, ]01-Jan-2025 11:36 Aerossurance Updated [Narrative, ]02-Jan-2025 16:05 Aerossurance Updated [Source, ]03-Jan-2025 11:49 Aerossurance Updated [Embed code, ] Corrections or additions? ... Edit this accident description The Aviation Safety Network is an exclusive service provided by: Quick Links: ASN Home Send Correction / FeedbackFSF Home DisclaimerCopyright Contact Us Privacy PolicyPress / Media CONNECT WITH US: ©2025 Flight Safety Foundation 1920 Ballenger Av, 4th Fl. Alexandria, Virginia 22314www.FlightSafety.org window.NREUM||(NREUM={});NREUM.info={""beacon"":""bam.nr-data.net"",""licenseKey"":""NRJS-b28a197507ed0552825"",""applicationID"":""582319234"",""transactionName"":""YwdaMkUCWRZSBhJfXVpNbRReTEAMWAwEV0FRTU8PXAoZFVsV"",""queueTime"":0,""applicationTime"":3,""atts"":""T0BZRA0YShg="",""errorBeacon"":""bam.nr-data.net"",""agent"":""""}ï»¿","https://aviation-safety.net/database/record.php?id=20200127-1"
"07:36","    McDonnell Douglas MD-83","Monday 27 January 2020","Caspian Airlines","EP-CPZ","53464/2091","1994","Pratt & Whitney JT8D-219","0 / Occupants: 144","0","Destroyed, written off","Accident","Bandar Mahshahr Airport (MRX) -   Iran","Landing","Passenger - Scheduled","Tehran-Mehrabad Airport (THR/OIII)","Bandar Mahshahr Airport (MRX/OIAM)"," AAIB Iran","Accident investigation report completed and information captured","A McDonnell Douglas MD-83 of Caspian Airlines suffered a runway excursion after landing on runway 13 at Bandar Mahshahr Airport in Iran. The aircraft stopped 90 meters beyond the paved end of the runway stopway in the middle of a road. All occupants safely evacuated the aircraft. The aircraft took off from Tehran-Mehrabad Airport at 06:24 hours local time and climbed to the cruising altitude of FL320. The flight was subsequently cleared direct to GODMO. After contacting the controller at Mahshahr the crew was informed: ""runway active is 31; wind is now 280/08kts, CAVOK, temperature +06, DP 04 and QNH 1023, expected VOR approach runway 31 via GODMO 1E Arrival"". The flight responded by requesting runway 13 for landing. ATC then cleared the flight for a VOR/DME approach to runway 13 using the GODMO 1F Arrival procedure. At 07:30:41 local time, the pilot reported over position GODMO at FL100. ATC replied: ""CPN 6936 yes sir; descend as profile to MNM 2000 feet for VOR/DME APP RWY 13, report when leaving IAF and cleared approach."" At 07:32:46, the pilot reported leaving the Initial Approach Fix (IAF) MNM. At that time the aircraft was flying at an altitude at 6647 ft instead of 2000 ft as required. The controller cleared the flight to land. As the aircraft passed 2500 ft, the autopilot was disengaged. Then the captain decided to control altitude and speed by executing an S-turn maneuver several times and continued in visual reference with the ground. At 07:35:29, at altitude 934 ft, the captain asked the copilot to set speed and the copilot called out the target airspeed of 135 knots when the actual speed (IAS) at the time was 196 kt.  Upon receiving EGPWS Sink Rate warnings, the copilot warned the pilot to read the landing checklist, but the captain did not accept this and accomplished an unstabilized high-speed approach for the purpose of landing.  The copilot claimed in his statement after the accident that: ""I wanted to take control of the aircraft and follow missed approach procedure but due to pilot over-confidence to overcome present situation and age gap, I disregarded it."" The captain was a 64-year old pilot with over 18000 flying hours, compared to the 28-year old copilot who had 300 hours. From 1000 ft until 10 ft altitude, sink rate and pull up warnings sounded in the cockpit successively. Finally, at 07:36:11, the aircraft landed with high speed (171 kt) after passing two-thirds of the runway. It touched down nosegear-first and bounced. Full auto thrust reversers and brakes were applied. The aircraft overran the runway, rolled through a non-paved area and airport perimeter fence, passed a shallow canal then onto an adjacent roadway, where it struck a concrete median strip and a lamp post before coming to a stop.  Runway 13 has a Landing Distance Available (LDA) of 8874 feet (2705 m). Probable Causes: The Aircraft Accident Investigation Board determines that the probable causes of this accident were the pilotsÂ failures below, resulting in a runway overrun: - Poor decision-making for acceptance of the risk of high-speed landing; - Un-stabilized approach against the normal flight profile; - Poor CRM in the cockpit; and - Poor judgment and not accomplishing go-around while performing an unstabilized approach. Contributing Factors: - Loading of 5 tons of extra fuel, which increased the landing distance required. - Decision to make a landing on RWY 13 with tailwind. - Inability of the copilot (PM) to take control of the aircraft and proper action to execute go-around.METAR: 03:00 UTC / 06:30 local time: OIAM 270300Z 29008KT 8000 NSC 06/04 Q102204:00 UTC / 07:30 local time: OIAM 270400Z 28006KT CAVOK 06/04 Q102305:00 UTC / 08:30 local time: OIAM 270500Z 29006KT 7000 NSC 07/05 Q1023Accident investigation:   Investigating agency: AAIB Iran Report number: A981107EPCPZ Status: Investigation completedDuration: 7 monthsDownload report:  Final report Sources: CAO Iran   Location  Images: photo (c) Mehr News, Ahmad Rostami; Bandar Mahshahr Airport (MRX/OIAM); 27 January 2020 photo (c) Mehr News, Ahmad Rostami; Bandar Mahshahr Airport (MRX/OIAM); 27 January 2020 photo (c) Mehr News, Ahmad Rostami; Bandar Mahshahr Airport (MRX/OIAM); 27 January 2020 photo (c) Mehr News, Ahmad Rostami; Bandar Mahshahr Airport (MRX/OIAM); 27 January 2020 photo (c) Mehr News, Ahmad Rostami; Bandar Mahshahr Airport (MRX/OIAM); 27 January 2020 photo (c) Mehr News, Ahmad Rostami; Bandar Mahshahr Airport (MRX/OIAM); 27 January 2020 photo (c) AAIB Iran; Bandar Mahshahr Airport (MRX); 27 January 2020 photo (c) Javidfa; Tehran-Mehrabad Airport (THR/OIII); 01 June 2017; (CC:by-sa) Revision history:Date/timeContributorUpdates The Aviation Safety Network is an exclusive service provided by: Quick Links: ASN Home Send Correction / FeedbackFSF Home DisclaimerCopyright Contact Us Privacy PolicyPress / Media CONNECT WITH US: ©2025 Flight Safety Foundation 1920 Ballenger Av, 4th Fl. Alexandria, Virginia 22314www.FlightSafety.org window.NREUM||(NREUM={});NREUM.info={""beacon"":""bam.nr-data.net"",""licenseKey"":""NRJS-b28a197507ed0552825"",""applicationID"":""582319234"",""transactionName"":""YwdaMkUCWRZSBhJfXVpNbRReTEAMWAwEV0FRTU8PXAoZFVsV"",""queueTime"":0,""applicationTime"":3,""atts"":""T0BZRA0YShg="",""errorBeacon"":""bam.nr-data.net"",""agent"":""""}ï»¿","https://aviation-safety.net/database/record.php?id=20200127-0"
"17:35 LT","    Boeing 737-6CT","Tuesday 28 January 2020","WestJet","C-GWJU","34289/1956","2006","CFMI CFM56-7B","0 / Occupants: 85","0","Substantial, repaired","Accident","Vancouver International Airport, BC (YVR/CYVR) -   Canada","Standing","Passenger - Scheduled","Edmonton International Airport, AB (YEG/CYEG)","Vancouver International Airport, BC (YVR/CYVR)",NA,"Information verified through data from accident investigation authorities","WestJet flight WJA141, a Boeing 737-600 (C-GWJU) and WestJet flight WJA717, a Boeing 737-700 (C-FZWS)  were involved in a ground contact accident at Vancouver International Airport, BC (YVR/CYVR). WJA141 stopped short of the lead-in line for gate B15, with engines running, awaiting ground crew to marshal the aircraft to the gate. Meanwhile, WJA717 was taxing eastbound on the apron towards the lead-in line for gate B13. The left winglet of C-FZWS contacted the right-hand horizontal stabilizer of C-GWJU. There were no injuries. Both aircraft sustained substantial damage.Sources: TSB A20P0011 History of this aircraft Other occurrences involving this aircraft ï»¿  2 June 2011 C-GWJU Westjet 0 155 NM SW of EDMONTON INTERNATIONAL AIRPORT (CYEG) non Loss of pressurization Revision history:Date/timeContributorUpdates11-Jun-2023 16:19 harro Added Corrections or additions? ... Edit this accident description The Aviation Safety Network is an exclusive service provided by: Quick Links: ASN Home Send Correction / FeedbackFSF Home DisclaimerCopyright Contact Us Privacy PolicyPress / Media CONNECT WITH US: ©2025 Flight Safety Foundation 1920 Ballenger Av, 4th Fl. Alexandria, Virginia 22314www.FlightSafety.org window.NREUM||(NREUM={});NREUM.info={""beacon"":""bam.nr-data.net"",""licenseKey"":""NRJS-b28a197507ed0552825"",""applicationID"":""582319234"",""transactionName"":""YwdaMkUCWRZSBhJfXVpNbRReTEAMWAwEV0FRTU8PXAoZFVsV"",""queueTime"":0,""applicationTime"":3,""atts"":""T0BZRA0YShg="",""errorBeacon"":""bam.nr-data.net"",""agent"":""""}ï»¿","https://aviation-safety.net/wikibase/315112"
"17:35 LT","    Boeing 737-76N (WL)","Tuesday 28 January 2020","WestJet","C-FZWS","32731/1044","2001","CFMI CFM56-7B","0 / Occupants: 92","0","Substantial, repaired","Accident","Vancouver International Airport, BC (YVR/CYVR) -   Canada","Taxi","Passenger - Scheduled","Toronto-Pearson International Airport, ON (YYZ/CYYZ)","Vancouver International Airport, BC (YVR/CYVR)",NA,"Information verified through data from accident investigation authorities","WestJet flight WJA141, a Boeing 737-600 (C-GWJU) and WestJet flight WJA717, a Boeing 737-700 (C-FZWS)  were involved in a ground contact accident at Vancouver International Airport, BC (YVR/CYVR). WJA141 stopped short of the lead-in line for gate B15, with engines running, awaiting ground crew to marshal the aircraft to the gate. Meanwhile, WJA717 was taxing eastbound on the apron towards the lead-in line for gate B13. The left winglet of C-FZWS contacted the right-hand horizontal stabilizer of C-GWJU. There were no injuries. Both aircraft sustained substantial damage.Sources: TSB A20P0011 History of this aircraft Other occurrences involving this aircraft ï»¿  8 February 2009 C-FZWS WestJet 0 near Santo Domingo non Turbulence Revision history:Date/timeContributorUpdates11-Jun-2023 16:20 harro Updated Corrections or additions? ... Edit this accident description The Aviation Safety Network is an exclusive service provided by: Quick Links: ASN Home Send Correction / FeedbackFSF Home DisclaimerCopyright Contact Us Privacy PolicyPress / Media CONNECT WITH US: ©2025 Flight Safety Foundation 1920 Ballenger Av, 4th Fl. Alexandria, Virginia 22314www.FlightSafety.org window.NREUM||(NREUM={});NREUM.info={""beacon"":""bam.nr-data.net"",""licenseKey"":""NRJS-b28a197507ed0552825"",""applicationID"":""582319234"",""transactionName"":""YwdaMkUCWRZSBhJfXVpNbRReTEAMWAwEV0FRTU8PXAoZFVsV"",""queueTime"":0,""applicationTime"":3,""atts"":""T0BZRA0YShg="",""errorBeacon"":""bam.nr-data.net"",""agent"":""""}ï»¿","https://aviation-safety.net/wikibase/315113"
"","    Hawker 900XP","Thursday 30 January 2020","ALE - Aerolineas Ejecutivas","XA-BNG","HA-0028","2007","Honeywell TFE731-50R","0 / Occupants: 0","0","Destroyed, written off","Other","Monterrey-Aeropuerto Del Norte (NTR) -   Mexico","Standing","-","-","-",NA,"Information is only available from news, social media or unofficial sources","The aircraft sustained fire damage to the aft left fuselage during maintenance involving recharging of the oxygen tanks and was subsequently declared a constructive total loss.Sources: McLarens salvage  Revision history:Date/timeContributorUpdates The Aviation Safety Network is an exclusive service provided by: Quick Links: ASN Home Send Correction / FeedbackFSF Home DisclaimerCopyright Contact Us Privacy PolicyPress / Media CONNECT WITH US: ©2025 Flight Safety Foundation 1920 Ballenger Av, 4th Fl. Alexandria, Virginia 22314www.FlightSafety.org window.NREUM||(NREUM={});NREUM.info={""beacon"":""bam.nr-data.net"",""licenseKey"":""NRJS-b28a197507ed0552825"",""applicationID"":""582319234"",""transactionName"":""YwdaMkUCWRZSBhJfXVpNbRReTEAMWAwEV0FRTU8PXAoZFVsV"",""queueTime"":0,""applicationTime"":4,""atts"":""T0BZRA0YShg="",""errorBeacon"":""bam.nr-data.net"",""agent"":""""}ï»¿","https://aviation-safety.net/database/record.php?id=20200130-0"
