"Time","Type","Date","Owner.operator","Registration","MSN","Year.of.manufacture","Engine.model","Fatalities","Other.fatalities","Aircraft.damage","Category","Location","Phase","Nature","Departure.airport","Destination.airport","Investigating.agency","Confidence.Rating","Narrative","detail_link"
"","    Cessna 560 Citation Encore","Wednesday 12 February 2020","SC Cole Aviation LLC","N654CE","560-0654","2004Total airframe hrs:3666 hours","Pratt & Whitney Canada PW535A","0 / Occupants: 2","0","Substantial, repaired","Accident","over Benbrook, TX -   United States of America","En route","Executive","Dallas-Love Field, TX (DAL/KDAL)","Midland International Air and Space Port, TX (MAF/KMAF)"," NTSB","Accident investigation report completed and information captured","A Cessna 560 Citation Encore airplane, N654CE, was substantially damaged when two engine cowlings departed the airplane inflight over Benbrook, Texas. The pilot and the one passenger were not injured.  The airplane was climbing through flight level (FL) 225 for FL 380, when the pilot heard a ""loud crashing noise"" followed by a ""turbulent air sound"" he described as similar to flying with the main landing gear extended. At time of the initial noise, the pilot reported the airplane was on a heading of 255, the airspeed was about 265 to 270 kts, and the autopilot system was engaged. The autopilot system was set to lateral navigation and the vertical speed was set for 1,500 ft per minute for climbing.  The pilot reacted to the initial noise by disconnecting the autopilot system, announcing the issue to air traffic control (ATC), slowing down the airplane to 170 kts, and descending to 11,000 ft above mean sea level. There were no master caution or warning lights illuminated on the cockpit annunciation panel. The pilot initially thought the airplane had a main landing gear malfunction based of the sound of the airflow around the cabin. The pilot slowed the airplane further, cycled the main landing gear, cycled the flaps, and moved the flight controls. He reported everything checked out normal except the ""turbulent air sound"" which was exacerbated with rudder movement. The pilot decided the main landing gear was functioning normally and there was a problem with the empennage. The pilot located the closest airport with a paved runway greater than a 5,000 ft length, contacted ATC, and proceeded to land at the Mineral Wells Airport (MWL), Texas. The pilot executed an uneventful landing at 15:45 and shutdown the airplane without further incident.  A post landing inspection revealed the top and bottom cowling for the number 2 (right) engine were missing. A portion of the separated cowlings was found wrapped around the inboard section of the right horizontal stabilizer. A portion of the separated cowlings impacted the area between the leading edge of the vertical stabilizer and the top of the fuselage, resulting in substantial damage. The remaining pieces of the separated cowlings have not been recovered.  On-scene examination revealed that receptacle 29, at the forward inboard side of the lower cowl door, was missing its stud, snap ring, and grommet and that receptacles 26 and 28 were missing their grommets and snap rings but had retained their studs. The most likely cause of the cowl door departure is that either the stud at receptacle 29 was left unlocked when the cowl door was attached, or an oversized stud was used at receptacle 29 that was able to rotate from the locked to unlocked position. Without the stud to examine and additional on-wing testing, it cannot be determined whether the stud at that location was a longer grip-length stud or if spontaneous unlocking of a longer grip-length stud is an actual possibility. The reason for the separation of the cowlings could not be determined because the stud in question was not recovered. Probable Cause: The in-flight separation of the upper and lower right engine cowlings for reasons that could not be determined based on available evidence.Accident investigation:   Investigating agency: NTSB Report number: CEN20LA082 Status: Investigation completedDuration: 2 years and 3 monthsDownload report:  Final report Sources:  Location  Images: photo (c) FAA; Benbrook, TX; February 2020 Revision history:Date/timeContributorUpdates The Aviation Safety Network is an exclusive service provided by: Quick Links: ASN Home Send Correction / FeedbackFSF Home DisclaimerCopyright Contact Us Privacy PolicyPress / Media CONNECT WITH US: ©2025 Flight Safety Foundation 1920 Ballenger Av, 4th Fl. Alexandria, Virginia 22314www.FlightSafety.org window.NREUM||(NREUM={});NREUM.info={""beacon"":""bam.nr-data.net"",""licenseKey"":""NRJS-b28a197507ed0552825"",""applicationID"":""582319234"",""transactionName"":""YwdaMkUCWRZSBhJfXVpNbRReTEAMWAwEV0FRTU8PXAoZFVsV"",""queueTime"":0,""applicationTime"":3,""atts"":""T0BZRA0YShg="",""errorBeacon"":""bam.nr-data.net"",""agent"":""""}ï»¿","https://aviation-safety.net/database/record.php?id=20200212-0"
"14:48","    Cessna 208 Caravan I","Friday 14 February 2020","Mission Aviation Fellowship - MAF","P2-MAI","20800613","2018Total airframe hrs:566 hoursCycles:1069 flights","Pratt & Whitney Canada PT6A-114A","0 / Occupants: 11","0","Substantial, repaired","Accident","Miyanmin Airstrip (MPX) -   Papua New Guinea","Landing","Passenger - Non-Scheduled/charter/Air Taxi","Telefomin Airstrip (TFM/AYTE)","Miyanmin Airstrip (MPX/AYIY)"," AIC PNG","Accident investigation report completed and information captured","A Cessna 208 Caravan aircraft, registered P2-MAI, owned and operated by Mission Aviation Fellowship (MAF) PNG Limited, experienced a loss of control during the landing roll at Miyanmin Airstrip, while conducting a non-scheduled flight, from Telefomin, PNG. There were 11 persons on board the aircraft; 2 pilots and 9 passengers. The pilot flying the aircraft was undergoing route and airstrip training. He was occupying the left seat and was Pilot Under Instruction (PUI). The pilot in the right seat was the instructor pilot for MAF conducting route and airstrip training for the new pilot. The pilot crossed overhead of the airstrip for an inspection of the surface and wind conditions. The crew did not observe any standing water or any wet areas on the strip. They also reported that the windsock indicated calm winds and the strip was clear. The aircraft joined mid-downwind less than half a nautical mile from the airstrip and tracked North West, descending from 1200 ft to 1000 ft before turning onto base. The aircraft began descending as it turned to line up on the final approach profile. There was a tailwind component of 5-12 kt on base and final. The aircraft overshot the turn onto final approach, 1.8 nm from the threshold at 900 ft. The pilot established the aircraft on the approach profile 1 nm from the threshold and at about 500 ft. The instructor stated that during final approach, the aircraft had descended below the normal approach profile causing him to instruct the pilot to adjust power and aim point to get back onto the correct profile. The pilot commenced the flare just under 20 ft AGL, 78 kt (85 kt ground speed). The aircraft touched down with an airspeed of 77 kt (82 kt ground speed) 36 m past the runway 11 threshold. The pilot stated that a few seconds after touchdown, he applied reverse thrust and the aircraft veered left. According to tyre track approximations, the aircraft appeared to have deviated about 220 m up-strip from threshold. The pilot stated that he applied full right rudder in an attempt to turn the aircraft back towards the center of the strip. The aircraft turned back to the right and rolled parallel to the centerline for another 100 m before it swerved left again, diverging at a 30Â° angle from the centerline. It rolled for 60 m as it bogged into the soft ground. The propeller blades subsequently struck the ground and the aircraft turned sharply left causing it to tip onto its starboard side. The crew reported that there were no injuries sustained during the accident and subsequent evacuation. Causes [Contributing factors] Onlanding,the PUI applied reverse thrust and the aircraft veered left of the centerline. Rudder was applied to get the aircraft back onto centerline, however, the rudder was not effective to counter the effect of reverse thrust as the left wheel entered in a softened area of the strip surface, which resulted in the aircraft being unable to regain the centerline as the landing roll progressed. The PUI did not effectively manage the effect of torque to maintain centerline during the landing roll.  The PUIÂs limited experience level on the aircraft type, low proficiency level in the use of reverse thrust during landing rolls, soft strip surface and soil condition were contributing factors of the accident.Accident investigation:   Investigating agency: AIC PNG Report number: AIC 20-1002 Status: Investigation completedDuration: 10 monthsDownload report:  Final report Sources: AIC PNG Media Release   Location  Images: photo (c) AIC PNG; Miyanmin Airstrip (MPX); February 2020 photo (c) AIC PNG; Miyanmin Airstrip (MPX); February 2020 photo (c) AIC PNG; Miyanmin Airstrip (MPX); February 2020 photo (c) AIC PNG; Miyanmin Airstrip (MPX); February 2020 Revision history:Date/timeContributorUpdates The Aviation Safety Network is an exclusive service provided by: Quick Links: ASN Home Send Correction / FeedbackFSF Home DisclaimerCopyright Contact Us Privacy PolicyPress / Media CONNECT WITH US: ©2025 Flight Safety Foundation 1920 Ballenger Av, 4th Fl. Alexandria, Virginia 22314www.FlightSafety.org window.NREUM||(NREUM={});NREUM.info={""beacon"":""bam.nr-data.net"",""licenseKey"":""NRJS-b28a197507ed0552825"",""applicationID"":""582319234"",""transactionName"":""YwdaMkUCWRZSBhJfXVpNbRReTEAMWAwEV0FRTU8PXAoZFVsV"",""queueTime"":0,""applicationTime"":3,""atts"":""T0BZRA0YShg="",""errorBeacon"":""bam.nr-data.net"",""agent"":""""}ï»¿","https://aviation-safety.net/database/record.php?id=20200214-0"
"06:12","    Boeing 737-8KN (WL)","Saturday 15 February 2020","Eastar Jet","HL8342","40237/3356","2010","CFMI CFM56-7B","0 / Occupants: 87","0","None","Accident","120NM south of Incheon International Airport -   South Korea","En route","Passenger - Scheduled","Kota Kinabalu Airport (BKI/WBKK)","Seoul-Incheon International Airport (ICN/RKSI)"," ARAIB","Accident investigation report completed and information captured","Eastar Jet flight ZE502, a Boeing 737-8KN, encountered turbulence at FL323. One passenger suffered a fracture of the sacrum and 4 cabin crew members suffered facial and other injuries. Ten passengers reported minor injuries  cause: The committee determines that the cause of this accident was âan encounter with clear air turbulence of unexpected intensity during descentâ. Contributing factors are determined as âlack of self-protection, such as passengers not wearing seat belts.âAccident investigation:   Investigating agency: ARAIB Report number:  Status: Investigation completedDuration: 2 years and 3 monthsDownload report:  Final report Sources: ARAIB History of this aircraft Other occurrences involving this aircraft ï»¿  21 January 2023 LN-NIL Norwegian 0 between Aalborg and Copenhagen min Bird strike Location  Revision history:Date/timeContributorUpdates17-Jun-2024 10:44 ASN Updated [Category, ] Corrections or additions? ... Edit this accident description The Aviation Safety Network is an exclusive service provided by: Quick Links: ASN Home Send Correction / FeedbackFSF Home DisclaimerCopyright Contact Us Privacy PolicyPress / Media CONNECT WITH US: ©2025 Flight Safety Foundation 1920 Ballenger Av, 4th Fl. Alexandria, Virginia 22314www.FlightSafety.org window.NREUM||(NREUM={});NREUM.info={""beacon"":""bam.nr-data.net"",""licenseKey"":""NRJS-b28a197507ed0552825"",""applicationID"":""582319234"",""transactionName"":""YwdaMkUCWRZSBhJfXVpNbRReTEAMWAwEV0FRTU8PXAoZFVsV"",""queueTime"":0,""applicationTime"":3,""atts"":""T0BZRA0YShg="",""errorBeacon"":""bam.nr-data.net"",""agent"":""""}ï»¿","https://aviation-safety.net/wikibase/302709"
"12:45","    Cessna 510 Citation Mustang","Thursday 20 February 2020","Private","N163TC","510-0039","2007Total airframe hrs:2380 hours","Pratt & Whitney Canada PW615F/A","0 / Occupants: 2","0","Substantial, written off","Accident","Daytona Beach International Airport, FL (DAB) -   United States of America","Landing","Private","Daytona Beach International Airport, FL (DAB/KDAB)","Daytona Beach International Airport, FL (DAB/KDAB)"," NTSB","Accident investigation report completed and information captured","The pilot was receiving a checkride from a designated pilot examiner for his single-pilot type rating in a turbine airplane. After a series of maneuvers, emergencies, and landings, the examiner asked the pilot to complete a no-flap landing. The pilot reported that he performed the Before Landing checklist with no flaps and believed that he had put the gear down. During touchdown, the pilot felt a ""thump"" and thought a tire had blown; however, he saw that the landing gear handle was in the ""up"" position, and he noted that the landing gear warning horn did not sound because he had performed a no-flaps landing. The examiner confirmed that the landing gear handle was in the ""up"" position. The pilot reported that there were no preaccident mechanical malfunctions or failures with the airplane that would have precluded normal operation. A Federal Aviation Administration inspector who examined the airplane reported that the landing gear handle was in the ""up"" position and that the fuselage had sustained substantial damage. The landing gear was lowered and locked into place without issue after the airplane was lifted from the runway. Probable cause: ""The pilot's failure to lower the landing gear before landing. Contributing to the accident was the examiner's failure to check that the landing gear was extended.""Accident investigation:   Investigating agency: NTSB Report number: ERA20CA125 Status: Investigation completedDuration: 6 monthsDownload report:  Final report Sources:  Location  Images: photo (c) NTSB; Daytona Beach International Airport, FL (DAB); 20 February 2020; (publicdomain) photo (c) Anon.; Daytona Beach International Airport, FL (DAB); 20 February 2020 Revision history:Date/timeContributorUpdates The Aviation Safety Network is an exclusive service provided by: Quick Links: ASN Home Send Correction / FeedbackFSF Home DisclaimerCopyright Contact Us Privacy PolicyPress / Media CONNECT WITH US: ©2025 Flight Safety Foundation 1920 Ballenger Av, 4th Fl. Alexandria, Virginia 22314www.FlightSafety.org window.NREUM||(NREUM={});NREUM.info={""beacon"":""bam.nr-data.net"",""licenseKey"":""NRJS-b28a197507ed0552825"",""applicationID"":""582319234"",""transactionName"":""YwdaMkUCWRZSBhJfXVpNbRReTEAMWAwEV0FRTU8PXAoZFVsV"",""queueTime"":0,""applicationTime"":3,""atts"":""T0BZRA0YShg="",""errorBeacon"":""bam.nr-data.net"",""agent"":""""}ï»¿","https://aviation-safety.net/database/record.php?id=20200220-2"
"06:03","    Beechcraft B200 King Air","Thursday 20 February 2020","Lauren Engineers & Constructors, Inc.","N860J","BB-1067","1982","Pratt & Whitney Canada PT6A-42","3 / Occupants: 3","0","Destroyed, written off","Accident","near Lake Coleman, TX -   United States of America","En route","Executive","Abilene Regional Airport, TX (ABI/KABI)","Harlingen-Valley International Airport, TX (HRL/KHRL)"," NTSB","Accident investigation report completed and information captured","A Beechcraft, B200 airplane, N860J, impacted terrain near Lake Coleman, Texas, in open ranch land. The pilot and two passengers were fatally injured, and the airplane was destroyed. The airplane was registered to TLC Air, LLC and operated by Lauren Engineers & Constructors, Inc.  The airplane was cleared for takeoff from runway 35L at Abilene Regional Airport, Texas. Shortly afterwards the pilot was instructed to climb to 12,000 ft and was then cleared to climb to FL230. The pilot reported to the controller that they encountered freezing drizzle and light rime icing on the climb from 6,400 ft to 8,000 ft. As the airplane climbed through 11,600 ft, the pilot reported that they were having an issue with faulty deicing equipment and needed to return to the airport. The controller instructed the pilot to descend to 11,000 ft and cleared them direct to Abilene Airport. The flight was then instructed to descend to 7,000 ft and asked if there was an emergency. The pilot responded in the negative and stated that they blew a breaker when they encountered icing conditions, and that it was not resetting. The controller then instructed the pilot to descend to 5,000 ft and to expect the ILS runway 35R approach. The controller then instructed the pilot to turn to a heading of 310. Shortly afterwards the controller asked the pilot if they were turning to the assigned heading; the pilot responded that they were having issues with faulty instruments. When controller asked the aircraft to report their altitude, the pilot reported that they were at 4,700 ft. The controller then instructed the pilot to maintain 5,000 ft. The pilot responded he was ""pulling up"". There was no further communication with the pilot. Preliminary review of the airplane's radar track showed the airplane's departure from ABI and the subsequent turn and southeast track towards its destination. The track appeared as a straight line before a right turn was observed. The turn radius decreased before the flight track disappeared. The airplane impacted terrain in a right wing low attitude, followed by the right engine, then left engine. The wreckage path was on an initial heading of 320Â°, and continued for about 570 ft. The wreckage was highly fragmented and spread-out along the wreckage path. Probable Cause: ""The pilotÂs loss of airplane control due to spatial disorientation. Contributing to the accident was the pilotÂs distraction with a ""popped"" circuit breaker and communications with air traffic control.""Accident investigation:   Investigating agency: NTSB Report number: CEN20FA093 Status: Investigation completedDuration: 2 years Download report:  Final report Sources: sanangelolive.com  brownwoodnews.com  Flightaware track   Location  Revision history:Date/timeContributorUpdates The Aviation Safety Network is an exclusive service provided by: Quick Links: ASN Home Send Correction / FeedbackFSF Home DisclaimerCopyright Contact Us Privacy PolicyPress / Media CONNECT WITH US: ©2025 Flight Safety Foundation 1920 Ballenger Av, 4th Fl. Alexandria, Virginia 22314www.FlightSafety.org window.NREUM||(NREUM={});NREUM.info={""beacon"":""bam.nr-data.net"",""licenseKey"":""NRJS-b28a197507ed0552825"",""applicationID"":""582319234"",""transactionName"":""YwdaMkUCWRZSBhJfXVpNbRReTEAMWAwEV0FRTU8PXAoZFVsV"",""queueTime"":0,""applicationTime"":3,""atts"":""T0BZRA0YShg="",""errorBeacon"":""bam.nr-data.net"",""agent"":""""}ï»¿","https://aviation-safety.net/database/record.php?id=20200220-1"
"10:45","    Antonov An-2T","Thursday 20 February 2020","T-Cement","RA-40642","1G213-49","1985",NA,"0 / Occupants: 14","0","Substantial, written off","Accident","Magadan-13 Airport -   Russia","Take off","Passenger - Non-Scheduled/charter/Air Taxi","Magadan-13 Airport (UHMT)","Seymchan Airport (UHMS)"," MAK","Information verified through data from accident investigation authorities","An Antonov An-2R crashed on takeoff from runway 01 at Magadan-13 Airport in Russia. Five of the 14 occupants were injured and the aircraft sustained substantial damage. The aircraft operated on a charter flight to fly mining shift workers and 445 kgs of luggage from Magadan to Seymchan. Shortly after takeoff, at a height of about 20 meters the airspeed decreased and the aircraft assumed a steep nose-up attitude before it fell and impacted a snowy field.Accident investigation:   Investigating agency: MAK Report number:  Status: Duration: Download report: Sources: Ministry of Emergencies of Russia for the Magadan Region  Far Eastern Investigation Directorate for Transport of the Investigative Committee of the Russian Federation  kolyma.ru   Location  Images: photo (c) Ministry of Emergencies of Russia for the Magadan Region; Magadan-13 Airport; 20 February 2020 photo (c) Far Eastern Invest. Dir. for Transport of the Investigative Committee; Magadan-13 Airport; 20 February 2020 Revision history:Date/timeContributorUpdates The Aviation Safety Network is an exclusive service provided by: Quick Links: ASN Home Send Correction / FeedbackFSF Home DisclaimerCopyright Contact Us Privacy PolicyPress / Media CONNECT WITH US: ©2025 Flight Safety Foundation 1920 Ballenger Av, 4th Fl. Alexandria, Virginia 22314www.FlightSafety.org window.NREUM||(NREUM={});NREUM.info={""beacon"":""bam.nr-data.net"",""licenseKey"":""NRJS-b28a197507ed0552825"",""applicationID"":""582319234"",""transactionName"":""YwdaMkUCWRZSBhJfXVpNbRReTEAMWAwEV0FRTU8PXAoZFVsV"",""queueTime"":0,""applicationTime"":3,""atts"":""T0BZRA0YShg="",""errorBeacon"":""bam.nr-data.net"",""agent"":""""}ï»¿","https://aviation-safety.net/database/record.php?id=20200220-0"
"03:30","    de Havilland Canada DHC-3T Vazar Turbine Otter","Friday 21 February 2020","Harbour Air","C-FIUZ","135","1956","Pratt & Whitney Canada PT6A-135A","0 / Occupants: 0","0","Substantial","Other","Vancouver-Coal Harbour SPB, BC (CXH) -   Canada","Standing","-","-","-",NA,"Information is only available from news, social media or unofficial sources","A float-equipped Seair Seaplanes de Havilland Canada DHC-2 Beaver was stolen when moored at Vancouver-Coal Harbour Seaplane Base, Canada. The Beaver impacted a float-equipped Harbour Air DHC-3T Vazar Turbine Otter (C-FIUZ) that was also moored in the harbour. It appears that the right-hand wing of the Beaver separated in the accident. The right-hand wing of the Turbine Otter suffered a serious fracture.Sources: theprovince.com  citynews1130.com  Seair Seaplanes  Revision history:Date/timeContributorUpdates The Aviation Safety Network is an exclusive service provided by: Quick Links: ASN Home Send Correction / FeedbackFSF Home DisclaimerCopyright Contact Us Privacy PolicyPress / Media CONNECT WITH US: ©2025 Flight Safety Foundation 1920 Ballenger Av, 4th Fl. Alexandria, Virginia 22314www.FlightSafety.org window.NREUM||(NREUM={});NREUM.info={""beacon"":""bam.nr-data.net"",""licenseKey"":""NRJS-b28a197507ed0552825"",""applicationID"":""582319234"",""transactionName"":""YwdaMkUCWRZSBhJfXVpNbRReTEAMWAwEV0FRTU8PXAoZFVsV"",""queueTime"":0,""applicationTime"":3,""atts"":""T0BZRA0YShg="",""errorBeacon"":""bam.nr-data.net"",""agent"":""""}ï»¿","https://aviation-safety.net/database/record.php?id=20200221-0"
